Sentences,Risk,Risk_Affinity,Likelihood,Consequences
"C&DH: Mid and High-level processor selection, data bus selection, and expansion port selection.",0,,,
"Flight Software (FSW): LLP OS; LLP algorithms for velocity limiting; Mid Level Processor (MLP) OS; control algorithms for control of position, orientation, velocity, angular velocity, and trajectory tracking; software for closed loop tests; and data logging.",0,,,
Propulsion: Tested control of 4 variable pitch propellers.,0,,,
"EPS: Battery selection, wiring and connectors for motors, motor controllers and processor, housekeeping voltage regulators design and fabrication to provide voltage levels needed by processor, motors and motor controllers GNC: IMU, camera for fiducial/Vision Based Navigation (VBN) tests.",0,,,
Communication: Functional communication system.,0,,,
Docking: A simple lance/cone to use as a target for navigation.,0,,,
"Prototype 3 focused on remote command and control, implementation of closed loop Vision Based Navigation (VBN), near-flight like avionics, and an approach to docking and perching.",0,,,
Subsystem development will focus on: Structure: Re-use of prototype 2 structure.,0,,,
EPS & C&DH: Near-flight design.,0,,,
Propulsion: Re-use of prototype 2 propulsion.,0,,,
Communication: Functional communication system.,0,,,
Flight Software (FSW): LLP near-flight design.,0,,,
Vision-based navigation algorithms.,0,,,
Remote commanding.,0,,,
Test support software.,0,,,
"GNC: Maturation to near flight design, including VBN and perching controller.",0,,,
Perching Arm: Near-flight design with a perching arm assembly.,0,,,
"Control stations: The Operator UI, ISS models, commanding and monitoring.",0,,,
This will also include minimal RAPID/DDS protocols.,0,,,
Prototype 4 will focus on the flight-like hardware design.,0,,,
"Structure: Flight like design, 3D printed, no “paint job”.",0,,,
Propulsion: Flight propulsion modules.,0,,,
C&DH: Flight avionics stack.,0,,,
GN&C: Flight IMU and software.,0,,,
Flight Software (FSW): Minimal software to enable testing of all hardware-related requirements.,0,,,
Thermal: Active Thermal control.,0,,,
Docking: Full dock to include the ISS interface.,0,,,
Non-flight like Dock.,0,,,
Control stations: Planning module / plan editor for the Operator Control Station.,0,,,
"The Certification Units will be developed off the final Prototype 4 design, with any modifications derived from the results of Prototype 4 testing.",0,,,
"These units will not only be used for performance testing, but also for environmental testing and ISS interface requirement verification and certification.",0,,,
Flight Software (FSW): Sufficient software to test hardware and all ISS and Safety requirements.,0,,,
"Control stations: Crew Control Station, updated planning and commanding UI.",0,,,
"Finally, two Flight Units will be developed.",0,,,
"These units will be developed, assembled, and curated in appropriate facilities following ARC procedures and processes for flight hardware.",0,,,
Challenges/Risks There are several technical challenges to the development of Astrobee.,0,,,
"First is the accuracy of a navigation system for localizing, positioning, orientation and pointing.",0,,,
Astrobee requires a robust navigation system that can localize throughout the entire U.S. orbital segment on ISS.,0,,,
"Rather than build up the ISS infrastructure to include multiple positioning beacons, Astrobee team is looking for a vision-based navigation (VBN) solution.",0,,,
"However, there are not any VBN solutions readily available for mobile devices.",1,Technical,,
"The HET project has tested a prototype commercial product that offers VBN, however preliminary testing of that device indicates that it will not work well in 0g.",0,,,
"Therefore, it may be necessary for HET2 to develop its own mobile VBN system.",0,,,
This still may not meet Astrobee accuracy requirements.,0,,,
"As a fall back plan, the team may propose to use Augmented Reality (AR) targets in one area of the ISS for high accuracy navigation operations.",0,,,
"The ISS has limitations on the amount of noise caused by a payload, both continuously and intermittently.",1,Technical,,
Astrobee team will need to find high performance fans that fall within the noise limits.,0,,,
One of the most significant challenges in the development of Astrobee is developing a system that meets human spaceflight safety standards for an anonymous free-flying robot.,1,Technical,,
The Payload Safety Review Panel (PSRP) at JSC approves all ISS payloads.,0,,,
The PSRP has a standard set of hazards that each payload must assess and prove that the hazard is not applicable or mitigated.,0,,,
The team must also determine if there are other unique hazards for their payload.,0,,,
"For a free-flying robot, the possibility of collisions is most definitely a unique hazard.",1,Technical,,
Mitigating this hazard for an autonomous free-flyer (meaning crew cannot be used for hazard mitigation) will be a significant challenge.,1,Technical,,
Milestones Table 4.,0,,,
"Astrobee Technology Development Task Milestones Controlled Milestone Description Date ––––– Prototype 2 design ready for integration, validation & test 1/15/2015 ––––– Prototype 3 design ready for integration, validation & test 6/1/2015 ––––– Prototype 4 design ready for integration, validation & test 1/4/2016 ––––– Cert Unit design ready for integration, validation & test 2/1/2017 ––––– Flight Unit design ready for integration, validation & test 4/30/2017 Astrobee Validation and Test Task Objectives This task is focused on the integration, validation and testing of Astrobee development efforts.",0,,,
"This task includes the hardware, software, procedures and project-owned facilities required to perform Astrobee system level integration, validation and tests of Astrobee, dock, payloads, and control stations.",0,,,
"Approach Astrobee will be tested incrementally, as each prototype is developed and delivered.",0,,,
"Each prototype has stated objectives, both as overall system, and for subsystem development.",0,,,
"Astrobee testing will verify requirements allocated to the respective prototype, and validate system capabilities.",0,,,
Prototype 1 testing completed before the baseline of this project plan.,0,,,
"This testing focused on open-loop operations, and basic linear/rotational acceleration, and was conducted on the air-bearing table in the Ames SPHERES Granite Lab.",0,,,
Prototype 2 testing focuses on closed-loop operations and navigation.,0,,,
"The tests will primarily address closed-loop operation, 1-D angle and angular velocity tracking, and 2-D position, velocity and trajectory tracking.",0,,,
"The tests will be performed on the air-bearing table in the SPHERES Granite Lab, the spherical air-bearing platform in the Ames Generalized Nanosatellite Testbed (GNAT) Lab, and will require an external positioning system for ground truth comparison.",0,,,
Prototype 3 testing focuses on basic commanding and VBN capabilities.,0,,,
"The tests will primarily address remote commanding, closed-loop VBN operation, the perching arm approach, grip and release of ISS structure.",0,,,
The tests will be performed on the air-bearing table in the Ames SPHERES Granite Lab and the Ames Micro Gravity Test Facility (MGTF).,0,,,
Prototype 4 testing focuses on validation of the hardware design.,0,,,
These tests will primarily address performance and hardware related requirements.,0,,,
"The tests will be performed on the air-bearing table in the Ames SPHERES Granite Lab, the Ames Micro Gravity Test Facility (MGTF), and will also require operator control from a remote facility, such as the Ames Multi Mission Operations Center (MMOC).",0,,,
"Certification Unit testing focuses on performance testing, ISS interface testing, and safety certification.",0,,,
"These tests will primarily address overall Astrobee capabilities, ISS and launch interfaces (loads tests, ISS LAN tests, laptop interoperability, etc.)",0,,,
"and certification of ISS hazards (material off-gassing, collision and impact resistance, etc.).",0,,,
Flight Unit testing focuses on final performance verification and inspections prior to being shipped to JSC for launch processing.,0,,,
Challenges/Risks The major challenges and risks associated with Astrobee validation and testing parallel the same risks in Astrobee development.,0,,,
Astrobee will need meet the success criteria established for the requirements and technical challenges in design and development.,1,Technical,,
"Further, the test results will be presented to the PSRP for ISS certification.",0,,,
Milestones Table 5.,0,,,
Astrobee Validation and Test Milestones Controlled Milestone Description Date Astrobee-FY15 #1 Prototype 2 testing complete 2/15/2015 Astrobee-FY15 #2 Prototype 3 testing complete 7/28/2015 Astrobee-FY16 #1 Prototype 4 testing complete 4/25/2016 Astrobee-FY17 #1 Cert Unit testing complete 8/30/2017 Astrobee FY17 #2 Flight Units testing complete 9/30/2017 Astrobee ISS Commissioning Task Objectives The objectives of the Astrobee ISS commissioning task are to perform verification of Level 1 (L1) requirements (Table 3) and validation activities in order to: (1) provide the SPHERES Program with a robotic system that is ready for research facility operations and (2) support technology demonstrations for the ISS Program.,0,,,
"To meet these objectives, this task involves ISS activities to test and demonstrate Astrobee and ground activities to support the ISS work.",0,,,
"The ISS activities involve installation and activation, map data collection, basic checkout, performance characterization, and an operations demonstration.",0,,,
The ground activities involve map development and software tuning.,0,,,
"Approach This task will perform all ISS activities following the ISS payload process, including working with an ISS Payload Integration Manager (PIM) and the ISS Payload Safety Review Panel (PSRP) to obtain all necessary approvals and concurrence on documentation required for ISS activities.",0,,,
"In addition, the Astrobee Element will coordinate and jointly perform on-orbit tests and demonstrations with the SPHERES Program, including the SPHERES chief engineer and SPHERES operations team.",0,,,
"The Astrobee Element will develop crew operational procedures and ground operational, troubleshooting and maintenance procedures.",0,,,
"The team will create training material for crew and ground personnel, and conduct training for the Astrobee and SPHERES operations teams.",0,,,
"Further, the operations teams will conduct operational readiness tests (ORTs) in advance of each ISS activity.",0,,,
"Regression testing will be performed to verify correct performance after software configuration changes, enhancements, or patches.",0,,,
The first several on-orbit tasks will require ISS crew participation.,0,,,
"Crew will be required to install the Docking Station, plug batteries into the Astrobees, turn them on, and place them into the Docking Station for charging.",0,,,
"Next, they will need to be present while component checks are performed (nozzles opened, signal lights turned on, touch screen displays data, etc.)",0,,,
to verify those components work.,0,,,
Crew will then hold a single Astrobee and use its cameras to map a limited area of the ISS.,0,,,
"With a local map in place, crew will oversee some basic mobility tests, including autonomous docking (L1 requirement FFREQ-80).",0,,,
"Once that capability is proven, crew will no longer be required to tend to Astrobee commissioning activities.",0,,,
"Under control from the ground (L1 requirement FFREQ-75), Astrobee will perform increasingly complex mobility maneuvers that will help tune flight software, GNC software, and ground simulators.",0,,,
These tests will also be used to help characterize the system.,0,,,
Astrobee will also be used to incrementally expand its map of the ISS.,0,,,
"The free flyer will be commanded to the edge of its known map to ""peek out"" at unknown territory.",0,,,
The number of increments required to complete a map is the ISS USOS is not known.,0,,,
"However, since no crew time is required to perform incremental mapping, this is not expected to be an issue.",0,,,
"Finally, Astrobee will be demonstrated to its prospective customers.",0,,,
"Astrobee will demonstrate research facility operations (L1 requirement FFREQ-83) for the SPHERES Program, including operations running Guest Science software, as well as with and without a hardware payload.",0,,,
The Astrobee Element is dependent on the Advanced Exploration Systems Logistics Reduction (AES/LR) project having the REALM (RFID reader) payload ready for this demonstration.,0,,,
Astrobee will demonstrate mobile camera operations (L1 requirement FFREQ-89) for the ISS Program and Flight Operations Directorate.,0,,,
"Challenges/Risks The first several ISS activities require crew time, which is not guaranteed and is dependent upon ISS operational constraints involving crew.",1,Programmatic,,
"Priority may be given to other experiments (biological experiments with expiration dates, physiological experiments that require specific crew) or other activities (e.g., unplanned EVAs) may reduce the amount of time available for payloads.",0,,,
"Consequently, the project is planning for significant schedule margin to mitigate this risk.",0,,,
The Astrobee payload demonstration also depends on availability of the AES/LR REALM payload.,1,Programmatic,,
"If this payload is not available, then Astrobee/SPHERES will need to develop its own test payload for the demonstration.",1,Programmatic,,
All ISS payloads must submit a request for the number of crew hours they will require to support their on orbit activies.,0,,,
"Astrobee commissioning activities will be attempted with as little crew time as possible and will follow the appropriate Element control plans (concept of operations, payload integration agreement, etc) as listed in Appendix D:.",0,,,
"There are certain activities that will require crew (Dock installation, system activation, ISS mapping).",0,,,
"However, whenever possible, activities will be remotely controlled from the ground.",0,,,
"If any of these remotely controlled activities fail (e.g., Astrobee fails to find its way back to the Dock), the project may have to ask crew to intervene.",1,Programmatic,,
"The activities will be structured to minimize the risk that crew will be needed, but this approach precludes crew from having to oversee the entirety of Astrobee activities.",0,,,
"Milestones Table 6 Astrobee ISS Commissioning Milestones Controlled Milestone Description Date ----- Installation complete 1/31/2018 ----- Initial ISS mapping complete 3/31/2018 Astrobee-FY18 #1 Astrobee first flight/basic mobility complete 4/30/2018 ----- Astrobee autonomous flight demonstration 6/30/2018 Astrobee FY18 #2 Astrobee operations demonstration 9/15/2018 Robonaut 2 Element HET2 will continue the checkout and maturation of Robonaut 2 (R2), which is currently on ISS.",0,,,
R2 work will focus on demonstrating legged IVA mobility using the climbing legs that were installed during the HET project in August 2014.,0,,,
This work will be performed during FY15 to FY16-Q1.,0,,,
R2 Climbing Task Objectives This task is focused on continuing the checkout and advancement of R2 currently on the ISS.,0,,,
"R2’s legs were recently installed to its torso but R2 has yet to take its first steps so the objective of this task is to demonstrate R2’s ability to climb from hand rail to hand rail gaining experience with climbing gaits, forces and ops concepts.",0,,,
"Approach A series of incrementally challenging maneuvers will be scheduled for R2 beginning with the ungrasping of its currently held handrail, maneuvering away from the handrail and then using its vision system to identify and re-grasp that same handrail.",0,,,
"Eventually, R2 will demonstrate its ability to grasp handrails from an angled approach, avoid obstacles covering handrails, climb from one handrail to the next and maneuver within the ISS Lab module.",0,,,
R2 will also demonstrate its ability to stow and un-stow itself without crew assistance.,0,,,
This task also includes any maintenance required to keep R2 operational on ISS.,0,,,
Crew procedures for on-orbit tests will be developed and practiced on the R2 cert unit (on the ground).,0,,,
Coordination will be performed with the Payload Operations Integration Center at MSFC to obtain procedure approval and to obtain crew time for on-orbit sessions.,0,,,
Challenges/Risks Climbing has been demonstrated on the ground in a laboratory test environment so confidence is high this capability can be demonstrated on-orbit.,0,,,
"There is always risk that hardware may have been damaged during the launch process, but checkout testing to date on the ISS has shown no indication of damage.",1,Technical,,
"Maneuvering within the Space Station modules, given the clutter of cables and equipment, will be a challenge R2 will have to overcome.",1,Technical,,
The risk is R2 may be limited in its ability to navigate through the modules without crew assistance in clearing a translation path.,1,Technical,,
Milestones Table 7.,0,,,
R2 Climbing Task Milestones Controlled Milestone Description Date ––––– Move one End Effector to adjacent handrail 12/31/2014 ––––– Leg vision integration 1/31/2015 ––––– 60 deg – multi grip handrail grab 2/28/2015 R2-FY15 #1 Self-stow/unstow 5/30/2015 ––––– Avoid obstacle on handrail 5/30/2015 ––––– Path planning integration 7/31/2015 R2-FY15 #2 Multiple steps 9/30/2015 ––––– Crew procedures for power fault troubleshooting 11/30/2015 R2 IVA Task Development Objectives R2 demonstrated its ability to manipulate crew interfaces and tools during the HET project (TDM).,0,,,
"Thus, the objective of this task is demonstrate that R2 can successfully perform a complex IVA task that the ISS Program would like to perform robotically.",0,,,
Approach Work with the ISS Program to identify an IVA task that R2 can perform without crew assistance.,0,,,
"Ideally, the task will be one that is also relevant to EVA work.",0,,,
Perform a ground demonstration using the R2 Certification unit to define the required procedures before progressing to the on-orbit demonstration.,0,,,
Challenges/Risks Transitioning from a technology demonstration to an operational system is a significant challenge.,1,Technical,,
Successfully performing a task without crew intervention and also reducing crew workload is critical to proving the utility of R2.,1,Technical,,
"A key risk is that R2 will not be robust enough to operate repeatedly without crew intervention (e.g., system reboots).",1,Technical,,
Milestones Table 8.,0,,,
"R2 IVA Task Development Milestones Controlled Milestone Description Date ––––– IVA task selection 10/31/2014 R2-FY15 #3 Ground demonstration 6/30/2015 ––––– On-orbit initial trial 8/30/2015 R2 Efficient Programming Objectives This task will focus on developing software advances necessary to support R2 climbing and IVA task execution including machine vision, obstacle avoidance/path planning and integrated supervisory control interfaces.",0,,,
Approach Recent R2 hardware upgrades (increased computing capacity) and software upgrades (transition to open source Robot Operating System (ROS)) have paved the way for greatly enhancing the control of R2.,0,,,
"Taking advantage of new capabilities in ROS, including the infusion of algorithms developed by other ROS users, and on-board data processing will allow for more robust path planning and machine vision for R2 and “point and click” supervisory interfaces for ground controllers.",0,,,
An incremental approach will be used to increase the level of autonomy on R2.,0,,,
"Software developed in the lab will transition to the R2 simulation for evaluation, then proceed to certification testing prior to uplink to ISS.",0,,,
The goal is to reach a level of autonomy where ground support is only assisting the robot 5% of the time.,0,,,
"During FY16-Q1, activities to position the ISS R2 unit as an exploration IVA dexterous mobile testbed on ISS will be performed.",0,,,
Mobility software demonstrated as part of the FY15 IVA ground demonstration will be modified to increase robustness and additional supervisory features will be added to improve handrail-to-handrail climbing.,0,,,
The affordance template technique used for manipulation will be implemented with handrail templates allowing the human operator to supervise the selection of handrails.,0,,,
Extensive ground testing will be performed to ensure readiness for use on-orbit.,0,,,
Challenges/Risks Developing robust path planning and obstacle avoidance software algorithms is a major challenge.,1,Technical,,
Creating software to parameterize possible grasps will also be key to developing a supervisory control interface that is easily adaptable to real time situations.,1,Technical,,
"The risk is that R2’s safety control and monitoring system limits its capabilities, reducing its effectiveness and ability to quickly respond to on-orbit requests for support.",1,Technical,,
Milestones Table 9.,0,,,
R2 Efficient Programming Milestones Controlled Milestone Description Date ––––– Updated R2 simulation 11/30/2014 ––––– Vision architecture implemented 3/31/2015 ––––– Grasp planning library 5/31/2015 ––––– Integrated supervisory control interfaces 8/31/2015 ––––– Supervised midrange handrail localization 12/31/2015 Performance The HET2 Key Performance Parameters (KPP) for Astrobee are listed in Table 10.,0,,,
"This table shows the current state-of-the-art (represented by the SPHERES free-flyer currently on ISS), project threshold values (minimum success), and project goal (full success).",0,,,
Maximum velocity is based on the speed required by research payload users and flight controllers.,0,,,
"Flight time represents performance needs to conduct ISS Flight Operations Directorate (FOD) tasks, such as providing camera views of astronauts doing a maintenance task.",0,,,
The flight time allows sufficient time for Astrobee to fly to any location with ISS (and get back afterwards).,0,,,
"Dock and resupply indicates whether (or not) crew time is required for replenishment of consumables (e.g., electrical power).",0,,,
Number of expansion ports represents the number of payloads that can be hosted.,0,,,
Consumables used per test session represents the quantity of supporting consumables that must be upmassed to support one operational session.,0,,,
ISS operational space represents the volume in which a ISS free flyer can operate.,0,,,
"Key Performance Parameters (Astrobee) Parameter State of the Art (SPHERES) Threshold Value (Minimum success) Project Goal (Full success) Maximum velocity 4 cm/sec 10 cm/sec 40 cm/sec Flight time 0.5 hr 2 hr 5 hr Dock & resupply Crew tended Crew tended Autonomous # of expansion ports 1 2 4 Consumables used per test session 6 0 0 ISS operational space 2m x 2m x 2m JEM, US Lab, and Node 2 All USOS The HET2 Key Performance Parameters (KPP) for Robonaut 2 are listed in Table 11.",0,,,
"This table shows the current state-of-the-art (represented by Robonaut 2 experience to date), project threshold values (minimum success), and project goal (full success).",0,,,
"These KPPs are important for Robonaut to achieve because they demonstrate Robonaut’s independent mobility capability, including self-stowing and un-stowing.",0,,,
Mobility is important because it allows Robonaut to maneuver inside the spacecraft and get into position to perform various tasks and also extends to an EVA Robonaut where crew intervention will not be readily available.,0,,,
The KPPs also address the ISS Program’s desire to reduce the impact Robonaut operations have on crew time in the near term and to help eventually reduce crew time in the long term by performing a task that would otherwise be performed by the crew.,0,,,
Key Performance Parameters (Robonaut 2) Parameter State of the Art (Robonaut 2 / 2014) Threshold Value (Minimum success) Project Goal (Full success) Use vision to identify handrail and grab it 0 3 5 Use vision to grab handrail from angled approach 0 1 3 R2 un-stows itself from rack without crew assistance crew performed without crew assistance once without crew assistance multiple times R2 stows itself in rack without crew assistance crew performed without crew assistance once without crew assistance multiple times Vision system identifies obstacle covering handrail and plans around it resulting in proper grasp 0 1 1 R2 performs a complex IVA task 0 1 1 The Technology Readiness Level (TRL) advancement for Astrobee is detailed in Table 12 (Astrobee).,0,,,
The table shows the change in TRL from project start to finish for key component/subsystem technologies.,0,,,
