Sentences,Risk,Risk_Affinity,Likelihood,Consequences
Game Changing Development Program Human Exploration Telerobotics 2 (HET2) GCD Project Plan Document No.,0,,,
": GCDP-02-PLN-14080 Revision: B Document Date: 12/21/2016 Page 2 of 45 NASA Langley Research Center Hampton, VA 23681 Game Changing Development Program Human Exploration Telerobotics 2 (HET2) Project Plan Document Control Number: GCDP-02-PLN-14080 Revision: B Document Date: 12/21/2016 Effective Date: tbd This agreement is valid for two years from the date of signature although it may be changed through the GCD Change Request (CR) process.",0,,,
It is the responsibility of each of the signing parties to notify the others in the event that the plan cannot be met and to initiate the timely renegotiations of the terms of this agreement.,0,,,
"Human Exploration Telerobotics 2 - Signature Page Prepared By: Terrence Fong Date Project Manager NASA Ames Research Center Center Concurrence: David Alfano Date Chief (Acting), Intelligent Systems Division NASA Ames Research Center Approved By: Mary E. Wusk Date Program Manager Game Changing Development Program Document History Log Status Document Revision Effective Date Description of Change Baseline Initial 11/17/2014 To develop an initial baseline of the HET2 Project Plan Revision A 01/27/2016 Added Robonaut 2 plan for FY16-Q1.",0,,,
Clarified that Robonaut 2 element is only active during FY15 and FY16-Q1.,0,,,
Changed “Free-Flyer” to Astrobee.,0,,,
"Updated Astrobee budget, tasks, success criteria/TRL, schedule, and KPP’s.",0,,,
Added Astrobee L1 requirements.,0,,,
Added Task Agreement for SUPERball Bot.,0,,,
Revised reference to NASA Technology Roadmap (TA 4).,0,,,
Revision B tbd Extended Astrobee to FY18.,0,,,
Revised Astrobe FY17 task milestone dates.,0,,,
Added Astrobee ISS commissioning task including two controlled milestones in FY18.,0,,,
Updated GCD chief engineer.,0,,,
Clarified Astrobee transition to the AES/SPHERES program.,0,,,
Table of Contents 1.0 Objectives 6 1.1 Introduction 6 1.2 Technical Objectives 7 1.2.1 Astrobee 7 1.2.2 Robonaut 2 7 1.2.3 Success Criteria 8 1.3 Impact 8 1.4 Relevance 9 2.0 Technical Approach 11 2.1 Concept of Operations 11 2.2 ISS Testing 12 2.3 Astrobee Element 12 2.3.1 Level 1 Requirements 13 2.3.2 Astrobee Technology Development Task 13 2.3.3 Astrobee Validation and Test Task 17 2.3.4 Astrobee ISS Commissioning Task 19 2.4 Robonaut 2 Element 22 2.4.1 R2 Climbing Task 22 2.4.2 R2 IVA Task Development 23 2.4.3 R2 Efficient Programming 24 3.0 Performance 26 4.0 Systems Engineering 29 5.0 Management Approach 30 5.1 Organizational Structure 30 5.2 Reporting 32 5.2.1 Project Reporting 32 5.2.2 Programmatic Reporting 33 5.3 Reviews 33 5.4 Risk Management 34 5.5 Configuration Management 34 6.0 Resource Requirements 35 6.1 Funding Requirements 35 6.1.1 Astrobee External Resources 36 6.1.2 Robonaut 2 External Resources 36 6.2 Institutional Requirements 36 6.2.1 Astrobee 36 6.2.2 Robonaut 2 37 7.0 Schedule 38 7.1 Astrobee 38 7.2 Robonaut 2 39 8.0 Work Breakdown Structure 39 9.0 Strategy for Technology Transition 40 10.0 Security Plan 41 11.0 Safety Plan 42 12.0 National Environmental Policy Act (NEPA) Compliance 42 Appendix A: Acronym List 43 Appendix B: Key Personnel Contact Information 44 Appendix C: Task Agreement for SUPERball Bot (GCDP-02-TA-16028) 45 Appendix D: Applicable Documents 46 List of Tables Table 1.,0,,,
HET2 Success Criteria 8 Table 2.,0,,,
HET2 relevance to the 2015 Robotics and Autonomous Systems (TA 4) technology roadmap 9 Table 3.,0,,,
Astrobee Level 1 Requirements 13 Table 4.,0,,,
Astrobee Technology Development Task Milestones 17 Table 5.,0,,,
Astrobee Validation and Test Milestones 18 Table 6 Astrobee ISS Commissioning Milestones 21 Table 7.,0,,,
R2 Climbing Task Milestones 23 Table 8.,0,,,
R2 IVA Task Development Milestones 23 Table 9.,0,,,
R2 Efficient Programming Milestones 25 Table 10.,0,,,
Key Performance Parameters (Astrobee) 26 Table 11.,0,,,
Key Performance Parameters (Robonaut 2) 27 Table 13.,0,,,
TRL Advancement (Astrobee) 27 Table 14.,0,,,
TRL Advancement (Robonaut 2) 29 Table 15.,0,,,
Roles and Responsibilities 31 Table 16.,0,,,
Project Resource Allocations 35 Table 17.,0,,,
WBS Dictionary 40 List of Figures Figure 1.,0,,,
Organizational Structure 30 Figure 2.,0,,,
Key HET2 events 38 Figure 3.,0,,,
"WBS Structure 39 Objectives Introduction The purpose of the Human Exploration Telerobotics 2 (HET2) project is to mature telerobotics technology to increase the performance, reduce the cost, and improve the success of human space exploration.",0,,,
"To do this, HET2 will develop a new free-flying robot, Astrobee, and mature Robonaut 2, to: (1) off-load routine and repetitive work from astronauts, and (2) extend and enhance crew capabilities.",0,,,
HET2 will test these robots in laboratories on the ground and on the International Space Station (ISS).,0,,,
HET2 is a research and technology project within the Game Changing Development Program (GCD) in NASA's Space Technology Mission Directorate (STMD).,0,,,
"Future human space missions in Earth orbit, to the Moon, and to distant destinations offer many new opportunities for exploration.",0,,,
"However, astronaut time will always be in short supply, consumables (e.g., oxygen) will always be limited, and some work will not be feasible, or productive, for astronauts to do manually.",0,,,
"Remotely operated robots, however, can complement astronauts by performing this work under remote supervision by humans from a space station, spacecraft, habitat, or even from Earth.",0,,,
"Telerobots, particularly semi-autonomous systems, can increase the performance and productivity of human space exploration.",0,,,
"Telerobots are well suited to performing tasks that are tedious, highly repetitive, dangerous or long-duration, such as routine in-flight maintenance, systematic surveys, etc.",0,,,
Telerobots can also provide side-by-side assistance to astronauts during both intravehicular (IVA) and extravehicular activities (EVA).,0,,,
"Telerobots can also perform ""follow-up"" work to complete or supplement tasks started by humans.",0,,,
"Today, astronauts on the ISS not only conduct science activities, but they also perform a variety of tasks required for ISS housekeeping and in-flight system maintenance.",0,,,
The remote monitoring and operation of many ISS systems by ground control has become an accepted practice for certain ISS tasks during the past decade.,0,,,
"In terms of telerobotics, however, these tasks are limited to coarse positioning maneuvers of external payloads/structures using manipulator arms, such as the Space Station Remote Manipulator System (SSRMS).",0,,,
"However, other types of robots, particularly free-flyers and dexterous humanoids, offer significant potential to perform a greater variety of tasks.",0,,,
"These tasks include routine, repetitive or simple but long-duration work, such as conducting environment surveys, taking sensor readings or performing routine maintenance.",0,,,
"Thus, the central focus of HET2 is to develop, test, and demonstrate how advanced telerobots, which can be operated by ground controllers on Earth and by astronauts in space, can effectively and efficiently carry out these tasks.",0,,,
Technical Objectives HET2 is composed of two elements: Astrobee and Robonaut 2.,0,,,
Astrobee The Astrobee Element (FY15 to FY18) will focus on developing a new free-flying robot suitable for performing IVA work on the ISS.,0,,,
"The new robot will build upon technology and lessons learned from the Smart Synchronized Position Hold, Engage, Reorient, Experimental Satellite (SPHERES) robot, which was developed and tested by the Human Exploration Telerobotics (HET) project under the Technology Demonstration Missions (TDM) program.",0,,,
"Astrobee will be designed to address a variety of scenarios, which will be developed and detailed in collaboration with the Advanced Exploration Systems (AES) program and the ISS SPHERES Facility in the Human Exploration and Operations Mission Directorate (HEOMD).",0,,,
"Candidate scenarios include mobile sensor (including imagers), automated logistics (e.g., mobile inventory), and free-flying robotic testbed.",0,,,
"Success for Astrobee involves developing and testing robot technologies required for autonomous operations (including free-flying mobility), remote operation by ground controllers, and human-robot interaction with crew.",0,,,
"These technologies include propulsion, robot user interface (proximal and remote), supervisory control, payload interface, and/or navigation.",0,,,
Successful on-orbit testing and demonstration of these technologies following the ISS payload process will bring the system to TRL 8.,0,,,
Table 1 specifies which capabilities must be demonstrated for minimum and full success.,0,,,
Robonaut 2 The Robonaut 2 Element (FY15 to FY16-Q1) will focus on advancing the capabilities of the Robonaut series of humanoid robots to perform both IVA and EVA on the ISS.,0,,,
"The continued advancement of Robonaut 2, which was developed and tested by HET and other NASA projects, will build upon technology and lessons learned to date from Robonaut 2.",0,,,
"Minimum success for the Robonaut 2 Element involves developing and testing relevant robotic technologies, including legged mobility with climbing limbs, autonomous task software, and/or computer vision to TRL 5.",0,,,
Success Criteria Table 1 summarizes the minimum and full success criteria for HET2.,0,,,
"HET2 Success Criteria Element Minimum Success Full Success Astrobee ISS demonstration of: · Ground control · JEM/Node 2/US Lab map · Software upgrade · Hazard detection · Dock/undock · Streamed video · Payload & Guest Science (GS) operations · GS data distribution ISS demonstration of: · Crew control · USOS map · Signal lights · Perch/unperch · Multi-robot ops · Mobile camera ops Robonaut 2 Develop at least one of the following humanoid robot technologies to TRL 5: legged mobility, autonomous task software, and/or computer vision.",0,,,
Transition to Human Robotic Systems (HRS) project after minimal success criteria have been met.,0,,,
"Impact HET2 will benefit NASA by: (1) reducing the risks and cost in human spaceflight; (2) increasing human exploration and operation mission performance, and (3) providing remotely operated robots to improve astronaut efficiency (off-load routine and repetitive tasks) and capabilities (extend human reach and sphere of influence).",0,,,
"As humans prepare to venture deeper into space, consideration is being given to developing a cis-lunar ""waypoint facility"", perhaps at the Earth-Moon ""L2 Lagrange Point"", which would serve as a gateway to multiple destinations including the Moon, Near-Earth Asteroids (NEA), and Mars.",0,,,
"This facility would enable assembly and servicing of satellites, telescopes, and deep-space exploration vehicles.",0,,,
"This facility could also be used as a platform for astrophysics, heliophysics, and distant Earth observation.",0,,,
"This facility would also serve as a pre-cursor for a similar facility near Mars, perhaps in orbit or deployed on the surface of Phobos.",0,,,
"In contrast to the ISS, which is continuously manned, a waypoint facility will be intermittently occupied.",0,,,
"Consequently, there is a significant need to robotically care-take the facility, in order to maintain and repair systems in the absence of human crew.",0,,,
"These robots will perform both IVA and EVA work, remotely operated and supervised from Earth.",0,,,
"Telerobotic caretaking would focus on inspection, monitoring, routine maintenance, and contingency handling of the facility (and possibly attached structures, vehicles, etc.).",0,,,
"In particular, experience with the ISS has shown that power (generation, switching, storage), life support (air, water, thermal), data networking, and instruments all need to be maintained.",0,,,
"To do this, remotely operated robots, such as Astrobee and Robonaut 2, will need to be developed, tested, and placed into operational use on the ISS to understand the associated costs, benefits, limitations, and risks.",0,,,
Relevance HET2 is well aligned to the 2013 NASA Strategic Space Technology Investment Plan (SSTIP) in several ways.,0,,,
"First, the SSTIP identifies ""Robotics and Autonomous Systems"" as a core technology area that is indispensable for NASA's present and planned future missions.",0,,,
"Second, the SSTIP recommends that research and development address autonomous robotics and more on-board autonomy.",0,,,
"Finally, the SSTIP specifically identifies free-flying and humanoid robots to assist crew in performing routine or hazardous tasks as examples of strategic investment.",0,,,
One of the ways that HET2 will test technologies is on the ISS.,0,,,
"These technologies will benefit both current ISS missions and future missions, particularly deep-space human exploration.",0,,,
"As such, HET2 is also well aligned with NASA's Strategic Goal 1.1: ""Sustain the operation and full use of the ISS and expand efforts to utilize the ISS as a National Laboratory for scientific, technological, diplomatic, and educational purposes and for supporting future objectives in human space exploration.""",0,,,
"HET2 is broadly relevant to the 2015 ""Robotics and Autonomous Systems"" (TA 4) NASA Technology Roadmap.",0,,,
Table 2 describes how HET2 work will advance technology in all seven major TA 4 roadmap areas.,0,,,
"Finally, HET2 addresses the NASA Strategic Plan 2014 (NPD 1001.0B) as follows: Strategic Goal 1: Expand the frontiers of knowledge, capability, and opportunity in space HET2 will increase knowledge and understanding of how to design and operate remotely operated space robots in conjunction with human spaceflight HET2 will increase the capabilities of robots to perform IVA/EVA work in space HET2 will increase the efficiency of human explorers by allowing routine, repetitive work to be off-loaded to robots HET2 will enhance the capabilities of human explorers by enabling robots to be remotely operated by crew Table 2.",0,,,
"HET2 relevance to the 2015 Robotics and Autonomous Systems (TA 4) technology roadmap Technical Area HET2 Relevance TA4.1 Sensing and Perception Both Astrobee and Robonaut 2 will advance technology in 3D sensing (TA4.1.1), state estimation (TA4.1.2), onboard mapping (TA4.1.3), object, event, and activity recognition (TA4.1.4), and force and tactile sensing (TA4.1.5).",0,,,
"TA4.2 Mobility Both Astrobee and Robonaut 2 will advance technology in small-body and microgravity mobility (TA4.2.4), robot navigation (TA4.2.6), and mobility components (TA4.2.8).",0,,,
"TA4.3 Manipulation Robonaut 2 will advance technology in manipulator components (TA4.3.1), dexterous manipulation (TA4.3.2), and mobile manipulation (TA4.3.4).",0,,,
"TA4.4 Human-System Interaction Both Astrobee and Robonaut 2 will advance technology in multi-modal human-systems interaction (TA4.4.1), proximate interaction (TA4.4.3), distributed collaboration and coordination (TA4.4.5), and remote interaction (TA4.4.8).",0,,,
"TA4.5 System-Level Autonomy Both Astrobee and Robonaut 2 will advance technology in activity planning, sequencing, and execution (TA4.5.2).",0,,,
"TA4.6 Autonomous Rendezvous & Docking Both Astrobee and Robonaut 2 will advance technology in relative navigation sensors (TA4.6.1), guidance, navigation and control algorithms (TA4.6.2), and docking & capture mechanisms (TA4.6.3).",0,,,
"TA4.7 Systems Engineering Both Astrobee and Robonaut 2 will advance technology in modularity, commonality, and interfaces (TA4.7.1), robot modeling and simulation (TA4.7.3), and robot software (TA4.7.4).",0,,,
"Objective 1.1: Expand human presence into the solar system and to the surface of Mars to advance exploration, science, innovation, benefits to humanity, and international collaboration.",0,,,
"HET2 will develop two new classes of space robots (IVA free-flyer and dexterous humanoid) that can be used to tend, or caretake, human spacecraft / habitats that may be intermittently manned HET2 will advance exploration by enabling robotically tended ""waypoint"" facilities to be considered for deep-space exploration HET2 will produce numerous innovations in perception, control, and human-robot interaction for space robots Objective 1.7: Transform NASA missions and advance the Nation's capabilities by maturing crosscutting and innovative space technologies.",0,,,
"HET2 will create two new space robots (Astrobee and Robonaut 2) that incorporate a wide range of commercial off-the-shelf (COTS) components HET2 will mature, integrate and test open-source software and open standards for robotics and telerobotics HET2 will develop telerobotics technology that can be applied to a wide range of NASA missions, including the ISS, cis-lunar waypoint, Mars orbit, etc.",0,,,
Technical Approach The following sections describe the technical approach that will be used for Astrobee and Robonaut 2.,0,,,
"In keeping with NPR 7120.8, each HET2 Element will research and develop telerobotics technology in accordance with established research practices and NASA's standards to ensure the quality and acceptability in the community of the research results.",0,,,
"In addition, both Elements will perform a variety of ground and on-orbit tests (using the ISS) to characterize, validate, and verify the performance of hardware and software (components, subsystems and integrated system).",0,,,
"Concept of Operations HET2 will develop robot user interfaces, control modes, and human-robot teaming strategies to support the following concepts of operations (“conops”) for telerobotics: Crew control.",0,,,
"The crew performs planning, operations, contingency handling and analysis.",0,,,
Ground control supports crew on an intermittent and/or time-delayed basis.,0,,,
"This conops is appropriate when conditions (orbital geometry, time-delay, etc.)",0,,,
make it impractical for ground control to remotely operate robots in a productive manner.,0,,,
"This conops is also appropriate when a robot is used to extend, or enhance, crew capabilities (sensing, force, etc).",0,,,
Crew/ground shared.,0,,,
Earth-based ground control performs planning and analysis.,0,,,
The crew performs tactical operations.,0,,,
"This conops enables many robot command cycles to be performed, even when the robot is far from Earth.",0,,,
Ground control.,0,,,
"Earth-based ground control performs planning, operations, and analysis.",0,,,
The crew performs interventions when needed.,0,,,
This conops is well suited for handling contingencies that are beyond robot autonomy capabilities.,0,,,
ISS Testing HET2 will make use of the ISS for testing.,0,,,
"Although using the ISS can be complex (particularly in terms of certification and scheduling), the ISS is the only facility available for performing high fidelity, integrated simulations of future deep-space human missions.",0,,,
"In particular, ISS testing is the only way to con- firm that all significant environmental conditions, operational constraints, and other factors are replicated.",0,,,
"Ground-based simulators (laboratory tests, numerical simulations, etc.)",0,,,
"lack fidelity in many areas, including: Effect of micro-gravity on crew (this affects sensorimotor performance, etc.)",0,,,
"Effect of long-duration stay in space on crew (affects cognition, proficiency, etc.)",0,,,
"Crew activities, workload, and other sources of in-flight stress Flight vehicle constraints (including micro- gravity workspace, crew displays, etc.)",0,,,
"The HET2 systems and activities on ISS are classified as ISS payloads (experiments), and as such, must follow the ISS payload process.",0,,,
"This process may require up to 18-month lead-time to allow completion and compliance with: Payload agreements that provide requirements for ISS and supporting facilities Safety certification for launch (for hardware up-mass) and ISS operations Verification of interface requirements to the launch vehicle and to the ISS Development/delivery of engineering documents Development of crew procedures and training Scheduling of crew activity and resources Astrobee Element HET2 is developing Astrobee, a free-flying robot designed to operate inside the International Space Station (ISS).",0,,,
"Astrobee will address multiple scenarios: (1) micro-gravity robotics research facility on ISS, (2) remotely operated mobile sensor platform to perform IVA surveys (e.g., sound levels) and to provide mobile camera views, and (3) autonomous mobile inventory using a RFID scanner.",0,,,
This work will be performed during FY15 to FY18.,0,,,
"At the highest level, the system includes the free-flying robot itself, a dock for replenishing power, and the ground data systems for communication, control and data transfer.",0,,,
Astrobee will be self-contained and autonomous.,0,,,
Ideally it will be capable of fully autonomous localization and navigation inside the United States Operating Segment (USOS) of the International Space Station.,0,,,
"Astrobee will have video cameras on board that will allow it to serve as a remotely operated mobile camera platform, and may be used for localization and navigation.",0,,,
"Astrobee will also have an expansion port(s) where additional sensors and/or hardware can be attached for demonstration, testing and use aboard the station.",0,,,
Additional sensors that may be attached to or integrated with the free-flyer include a RFID reader and the necessary software to communicate with the inventory management system and a HD camera.,0,,,
Astrobee will communicate principally via the station LAN.,0,,,
The propulsion will use electric-motor-driven fans.,0,,,
Localization will include vision-based navigation with and without fiducials and a IMU.,0,,,
Astrobee will also include a perching arm to grab ISS handrails; this will allow Astrobee to hold position without using its propulsion system.,0,,,
Level 1 Requirements Astrobee will address the Level 1 requirements listed in Table 3.,0,,,
Astrobee Level 1 Requirements ID Description FFREQ-75 The Astrobee system shall provide remote control of the Astrobee free-flyer.,0,,,
FFREQ-80 The Astrobee system shall perform autonomous docking for consumable resupply.,0,,,
FFREQ-83 The Astrobee system shall host payloads.,0,,,
FFREQ-89 The Astrobee system shall stream HD video of crew activities.,0,,,
"Astrobee Technology Development Task Objectives This task is focused on incremental design and development of Astrobee that meets project, stakeholder, ISS and Safety requirements.",0,,,
"Stakeholders include the ISS SPHERES Facility, the SPHERES Working Group, HEOMD AES program, ISS program, and others.",0,,,
The project and stakeholders have provided general and use-case specific functional requirements.,0,,,
The primary purpose for Astrobee is to function as a micro-gravity research facility that will eventually succeed the existing SPHERES facility.,0,,,
"In contrast to SPHERES, which was designed to simulate satellites (e.g., in terms of propulsion method), Astrobee is being designed as a robot.",0,,,
"In particular, Astrobee will be based on mobile robot engineering principles (autonomy, perception, navigation, middleware, etc.",0,,,
"), will support telerobotic operations (crew and ground control), and will be capable of autonomous docking and resupply (similar to how robotic vacuum cleaners can autonomously recharge themselves).",0,,,
"Consequently, Astrobee will not be a “drop-in” replacement for SPHERES and will not be able to do everything that the current SPHERES can do.",0,,,
"However, Astrobee will be able to do many more things than the current SPHERES are capable of performing.",0,,,
"As an ISS payload, the ISS Program levies interface requirements on Astrobee for both launch and on-orbit.",0,,,
The ISS Payload Safety Review Panel (PSRP) approves ISS safety certifications.,0,,,
"Complying with certain safety standards mitigates many of the standard ISS safety standards, while others are met by design.",0,,,
"The deliverables for Astrobee system include the Astrobee element, which consists of structure, propulsion, C&DH, communications, thermal, electrical power, GNC, dock mechanism, and perching arm subsystems.",0,,,
"Astrobee system also includes the dock, payloads, and Ground Data Systems (user interfaces for crew control and ground control).",0,,,
Approach Astrobee will be developed incrementally over a series of prototypes.,0,,,
Early prototypes will address trade studies and areas of risk.,0,,,
Later prototypes will implement system requirements and incrementally mature the system design.,0,,,
Prototype 1 was completed before this Project Plan was baselined.,0,,,
"This prototype was developed for risk reduction purposes and included: Structure: Rough structural design for test frame, standoffs, motor mounts, propeller mounts, processor mounts, battery mounts, air bearing interface.",0,,,
"Flight Software (FSW): Low level Processor (LLP) operating system (OS), basic I/O for turning on/off motors, speed control, pitch control, basic software to run open-loop tests with thruster and motion control.",0,,,
Propulsion: Variable pitch propellers (not representative of final system).,0,,,
"EPS: Interim battery selection, wiring/connectors for motors, motor controllers and processor, housekeeping voltage regulators design and fabrication to provide voltage levels needed by processor, motors and motor controllers.",0,,,
Prototype 2 focused on closed loop navigation and interim avionics development.,0,,,
"The subsystem development focused on: Structure: Improved structural design for frame, mounting for motors, propellers, both processors, battery, IMU.",0,,,
